description	log10pvalue	representative
negative regulation of circadian rhythm	6.6156	negative regulation of circadian rhythm
negative regulation of biological process	1.6478	negative regulation of circadian rhythm
negative regulation of transcription, DNA-templated	3.2065	negative regulation of circadian rhythm
regulation of transcription, DNA-templated	2.1327	negative regulation of circadian rhythm
regulation of metabolic process	1.5016	negative regulation of circadian rhythm
mRNA cis splicing, via spliceosome	2.6491	mRNA cis splicing, via spliceosome
mRNA metabolic process	1.356	mRNA cis splicing, via spliceosome
RNA splicing	1.6419	mRNA cis splicing, via spliceosome
